movement_onset	onset	response_time	duration	coded_response	experiment_exp_id	item_coding	item_text	possible_responses	stim_duration	survey	text	time_elapsed	worker_id	junk
6.6	1.005	1.303625	3.9465	3.0	survey_medley	forward	I refuse things that are bad for me.	66,89,71,82,77	8500.0	brief		10141	s549	False
13.057	10.143	-1.377375	3.9465	2.0	survey_medley	reverse	I have a hard time breaking bad habits.	66,89,71,82,77	8500.0	brief		19755	s549	False
22.572	19.758	-1.477375	3.9465	3.0	survey_medley	reverse	I have trouble concentrating.	66,89,71,82,77	8500.0	brief		29370	s549	False
31.673	29.372	-1.990375	3.9465	5.0	survey_medley	reverse	I say inappropriate things.	66,89,71,82,77	8500.0	brief		39664	s549	False
43.228	39.667	-0.730375	3.9465	4.0	survey_medley	forward	I could do anything I want in the future.	66,89,71,82,77	8500.0	future_time		49755	s549	False
55.456	49.757	1.407625	3.9465	2.0	survey_medley	forward	Sometimes when I feel bad, I can't seem to stop what I am doing even though it is making me feel worse.	66,89,71,82	8500.0	upps		58825	s549	False
64.576	58.828	1.456625	3.9465	4.0	survey_medley	reverse	I have difficulty maintaining my focus on projects that take more than a few months to complete.	66,89,71,82,77	8500.0	grit		68984	s549	False
70.889	68.987	-2.389375	3.9465	4.0	survey_medley	forward	I am a hard worker.	66,89,71,82,77	8500.0	grit		78871	s549	False
82.607	78.873	-0.557375	3.9465	4.0	survey_medley	reverse	New ideas and projects sometimes distract me from previous ones.	66,89,71,82,77	8500.0	grit		88553	s549	False
92.804	88.554	-0.041375	3.9465	5.0	survey_medley	reverse	I often act without thinking through all the alternatives.	66,89,71,82,77	8500.0	brief		98098	s549	False
103.838	98.1	1.446625	3.9465	4.0	survey_medley	reverse	I often set a goal but later choose to pursue a different one.	66,89,71,82,77	8500.0	grit		109412	s549	False
112.57	109.415	-1.136375	3.9465	4.0	survey_medley	forward	Many opportunities await me in the future.	66,89,71,82,77	8500.0	future_time		119027	s549	False
122.995	119.028	-0.324375	3.9465	4.0	survey_medley	forward	My future seems infinite to me.	66,89,71,82,77	8500.0	future_time		128232	s549	False
130.741	128.235	-1.785375	3.9465	4.0	survey_medley	forward	There is plenty of time left in my life to make new plans.	66,89,71,82,77	8500.0	future_time		137779	s549	False
141.277	137.781	-0.795375	3.9465	3.0	survey_medley	reverse	I am lazy.	66,89,71,82,77	8500.0	brief		147257	s549	False
152.674	147.259	1.123625	3.9465	4.0	survey_medley	forward	Setbacks don't discourage me.	66,89,71,82,77	8500.0	grit		156463	s549	False
161.971	156.465	1.214625	3.9465	1.0	survey_medley	forward	When I am really excited, I tend not to think of the consequences of my actions.	66,89,71,82	8500.0	upps		166553	s549	False
171.932	166.556	1.084625	3.9465	2.0	survey_medley	forward	Do you sometimes like doing things that are a bit frightening?	66,89	8500.0	impulsive_venture		177460	s549	False
182.844	177.462	1.090625	3.9465	3.0	survey_medley	forward	I am good at resisting temptation.	66,89,71,82,77	8500.0	brief		187346	s549	False
194.86	187.348	3.220625	3.9465	4.0	survey_medley	reverse	I do certain things that are bad for me, if they are fun.	66,89,71,82,77	8500.0	brief		196484	s549	False
201.054	196.487	0.275625	3.9465	4.0	survey_medley	forward	I am able to work effectively toward long-term goals.	66,89,71,82,77	8500.0	brief		206847	s549	False
211.545	206.849	0.404625	3.9465	4.0	survey_medley	reverse	Pleasure and fun sometimes keep me from getting work done.	66,89,71,82,77	8500.0	brief		216529	s549	False
220.952	216.531	0.129625	3.9465	1.0	survey_medley	forward	Others would say I make bad choices when I am extremely happy about something.	66,89,71,82	8500.0	upps		226687	s549	False
230.076	226.69	-0.905375	3.9465	1.0	survey_medley	forward	There are only limited possibilities in my future.	66,89,71,82,77	8500.0	future_time		235894	s549	False
239.3	235.897	-0.888375	3.9465	5.0	survey_medley	forward	I finish whatever I begin.	66,89,71,82,77	8500.0	grit		247073	s549	False
251.026	247.076	-0.341375	3.9465	4.0	survey_medley	forward	Most of my life lies ahead of me.	66,89,71,82,77	8500.0	future_time		256348	s549	False
260.608	256.35	-0.033375	3.9465	3.0	survey_medley	forward	People would say that I have iron self-discipline.	66,89,71,82,77	8500.0	brief		265962	s549	False
270.531	265.964	0.275625	3.9465	4.0	survey_medley	reverse	Sometimes I can't stop myself from doing something, even if I know it is wrong.	66,89,71,82,77	8500.0	brief		275032	s549	False
279.863	275.035	0.536625	3.9465	2.0	survey_medley	forward	Do you welcome new and exciting experiences and sensations even if they are a little frightening and unconventional?	66,89	8500.0	impulsive_venture		284035	s549	False
287.812	284.038	-0.517375	3.9465	4.0	survey_medley	forward	I expect that I will set many new goals in the future.	66,89,71,82,77	8500.0	future_time		298342	s549	False
300.752	298.344	-1.883375	3.9465	2.0	survey_medley	reverse	I wish I had more self-discipline.	66,89,71,82,77	8500.0	brief		307412	s549	False
314.104	307.414	2.398625	3.9465	1.0	survey_medley	forward	When I get really happy about something, I tend to do things that can have bad consequences.	66,89,71,82	8500.0	upps		317706	s549	False
320.7	317.709	-1.300375	3.9465	1.0	survey_medley	forward	I tend to act without thinking when I am really excited.	66,89,71,82	8500.0	upps		329497	s549	False
331.47	329.499	-2.320375	3.9465	4.0	survey_medley	forward	My future is filled with possibilities.	66,89,71,82,77	8500.0	future_time		338703	s549	False
342.681	338.705	-0.315375	3.9465	4.0	survey_medley	forward	As I get older, I begin to experience time as limited.	66,89,71,82,77	8500.0	future_time		348181	s549	False
351.316	348.182	-1.157375	3.9465	5.0	survey_medley	forward	I am diligent.	66,89,71,82,77	8500.0	grit		358134	s549	False
362.921	358.136	0.493625	3.9465	1.0	survey_medley	forward	When overjoyed, I feel like I cant stop myself from going overboard.	66,89,71,82	8500.0	upps		369992	s549	False
375.767	369.995	1.480625	3.9465	4.0	survey_medley	reverse	I have been obsessed with a certain idea or project for a short time but later lost interest.	66,89,71,82,77	8500.0	grit		379199	s549	False
385.888	379.202	2.394625	3.9465	2.0	survey_medley	forward	Would you enjoy the sensation of skiing very fast down a high mountain slope?	66,89	8500.0	impulsive_venture		390718	s549	False
395.541	390.72	0.529625	3.9465	4.0	survey_medley	forward	I have the sense that time is running out.	66,89,71,82,77	8500.0	future_time		399720	s549	False
