movement_onset	onset	response_time	duration	coded_response	experiment_exp_id	item_coding	item_responses	item_text	possible_responses	stim_duration	survey	text	time_elapsed	worker_id	junk
6.057	1.009	1.8049499999999998	3.932	2.0	survey_medley	reverse	66,89,71,82,77	I have difficulty maintaining my focus on projects that take more than a few months to complete.	66,89,71,82,77	8500.0	grit		12321	s608	False
15.932	12.322	0.36694999999999983	3.932	3.0	survey_medley	reverse	66,89,71,82,77	New ideas and projects sometimes distract me from previous ones.	66,89,71,82,77	8500.0	grit		21934	s608	False
25.323	21.936	0.14394999999999983	3.932	4.0	survey_medley	reverse	66,89,71,82,77	I do certain things that are bad for me, if they are fun.	66,89,71,82,77	8500.0	brief		31140	s608	False
35.27	31.142	0.8849499999999998	3.932	4.0	survey_medley	forward	66,89,71,82,77	I am good at resisting temptation.	66,89,71,82,77	8500.0	brief		40686	s608	False
43.446	40.688	-0.4850500000000002	3.932	4.0	survey_medley	reverse	66,89,71,82,77	I often act without thinking through all the alternatives.	66,89,71,82,77	8500.0	brief		50164	s608	False
51.855	50.165	-1.5530500000000003	3.932	3.0	survey_medley	forward	66,89,71,82,77	I am a hard worker.	66,89,71,82,77	8500.0	grit		59369	s608	False
62.174	59.372	-0.44105000000000016	3.932	5.0	survey_medley	forward	66,89,71,82,77	There is plenty of time left in my life to make new plans.	66,89,71,82,77	8500.0	future_time		69460	s608	False
71.895	69.462	-0.8100500000000002	3.932	1.0	survey_medley	forward	66,89,71,82,77	I have the sense that time is running out.	66,89,71,82,77	8500.0	future_time		80366	s608	False
83.658	80.37	0.044949999999999816	3.932	3.0	survey_medley	reverse	66,89,71,82,77	I have a hard time breaking bad habits.	66,89,71,82,77	8500.0	brief		90254	s608	False
94.232	90.26	0.7289499999999998	3.932	1.0	survey_medley	forward	66,89	Do you sometimes like doing things that are a bit frightening?	66,89,71,82,77	8500.0	impulsive_venture		99396	s608	False
101.329	99.398	-1.3120500000000002	3.932	3.0	survey_medley	forward	66,89,71,82,77	I finish whatever I begin.	66,89,71,82,77	8500.0	grit		109758	s608	False
113.694	109.764	0.6869499999999998	3.932	2.0	survey_medley	forward	66,89,71,82,77	Setbacks don't discourage me.	66,89,71,82,77	8500.0	grit		119444	s608	False
122.361	119.448	-0.3300500000000002	3.932	2.0	survey_medley	forward	66,89,71,82,77	People would say that I have iron self-discipline.	66,89,71,82,77	8500.0	brief		129604	s608	False
135.43	129.605	2.58195	3.932	3.0	survey_medley	forward	66,89,71,82	When I am really excited, I tend not to think of the consequences of my actions.	66,89,71,82,77	8500.0	upps		138809	s608	False
142.479	138.811	0.42494999999999983	3.932	4.0	survey_medley	forward	66,89,71,82,77	I am able to work effectively toward long-term goals.	66,89,71,82,77	8500.0	brief		149987	s608	False
154.775	149.99	1.5419499999999997	3.932	3.0	survey_medley	reverse	66,89,71,82,77	Sometimes I can't stop myself from doing something, even if I know it is wrong.	66,89,71,82,77	8500.0	brief		159262	s608	False
163.311	159.266	0.8019499999999998	3.932	3.0	survey_medley	forward	66,89,71,82,77	As I get older, I begin to experience time as limited.	66,89,71,82,77	8500.0	future_time		168878	s608	False
173.332	168.882	1.2069499999999997	3.932	2.0	survey_medley	forward	66,89,71,82	Others would say I make bad choices when I am extremely happy about something.	66,89,71,82,77	8500.0	upps		177950	s608	False
181.476	177.952	0.2809499999999998	3.932	2.0	survey_medley	reverse	66,89,71,82,77	Pleasure and fun sometimes keep me from getting work done.	66,89,71,82,77	8500.0	brief		186952	s608	False
188.573	186.955	-1.62505	3.932	3.0	survey_medley	forward	66,89,71,82,77	I am diligent.	66,89,71,82,77	8500.0	grit		201259	s608	False
204.316	201.261	-0.1880500000000002	3.932	2.0	survey_medley	forward	66,89,71,82	I tend to act without thinking when I am really excited.	66,89,71,82,77	8500.0	upps		210329	s608	False
212.788	210.33	-0.7850500000000001	3.932	5.0	survey_medley	reverse	66,89,71,82,77	I say inappropriate things.	66,89,71,82,77	8500.0	brief		220622	s608	False
222.229	220.626	-1.6400500000000002	3.932	4.0	survey_medley	forward	66,89,71,82,77	My future is filled with possibilities.	66,89,71,82,77	8500.0	future_time		232414	s608	False
234.694	232.415	-0.9640500000000002	3.932	2.0	survey_medley	reverse	66,89,71,82,77	I have trouble concentrating.	66,89,71,82,77	8500.0	brief		241619	s608	False
245.169	241.621	0.30494999999999983	3.932	2.0	survey_medley	forward	66,89	Do you welcome new and exciting experiences and sensations even if they are a little frightening and unconventional?	66,89,71,82,77	8500.0	impulsive_venture		251097	s608	False
253.311	251.102	-1.0340500000000001	3.932	5.0	survey_medley	forward	66,89,71,82,77	I expect that I will set many new goals in the future.	66,89,71,82,77	8500.0	future_time		261054	s608	False
263.062	261.06	-1.2410500000000002	3.932	1.0	survey_medley	forward	66,89,71,82,77	There are only limited possibilities in my future.	66,89,71,82,77	8500.0	future_time		272916	s608	False
276.151	272.922	-0.014050000000000182	3.932	3.0	survey_medley	reverse	66,89,71,82,77	I have been obsessed with a certain idea or project for a short time but later lost interest.	66,89,71,82,77	8500.0	grit		282126	s608	False
283.825	282.131	-1.5490500000000003	3.932	5.0	survey_medley	forward	66,89,71,82,77	I could do anything I want in the future.	66,89,71,82,77	8500.0	future_time		293647	s608	False
298.049	293.649	1.15695	3.932	1.0	survey_medley	forward	66,89,71,82	When overjoyed, I feel like I cant stop myself from going overboard.	66,89,71,82,77	8500.0	upps		302649	s608	False
304.721	302.654	-1.1760500000000003	3.932	5.0	survey_medley	forward	66,89,71,82,77	Most of my life lies ahead of me.	66,89,71,82,77	8500.0	future_time		311790	s608	False
315.043	311.794	0.005949999999999818	3.932	2.0	survey_medley	reverse	66,89,71,82,77	I am lazy.	66,89,71,82,77	8500.0	brief		321406	s608	False
325.08	321.41	0.42694999999999983	3.932	4.0	survey_medley	forward	66,89,71,82,77	I refuse things that are bad for me.	66,89,71,82,77	8500.0	brief		331022	s608	False
332.425	331.024	-1.8420500000000002	3.932	5.0	survey_medley	forward	66,89,71,82,77	Many opportunities await me in the future.	66,89,71,82,77	8500.0	future_time		341316	s608	False
344.825	341.318	0.2639499999999998	3.932	3.0	survey_medley	reverse	66,89,71,82,77	I often set a goal but later choose to pursue a different one.	66,89,71,82,77	8500.0	grit		351406	s608	False
357.759	351.41	3.10595	3.932	1.0	survey_medley	forward	66,89,71,82	When I get really happy about something, I tend to do things that can have bad consequences.	66,89,71,82,77	8500.0	upps		360478	s608	False
363.087	360.482	-0.6380500000000002	3.932	4.0	survey_medley	forward	66,89,71,82,77	My future seems infinite to me.	66,89,71,82,77	8500.0	future_time		370638	s608	False
374.189	370.642	0.30394999999999983	3.932	1.0	survey_medley	forward	66,89,71,82	Sometimes when I feel bad, I can't seem to stop what I am doing even though it is making me feel worse.	66,89,71,82,77	8500.0	upps		380526	s608	False
384.434	380.532	0.6589499999999998	3.932	2.0	survey_medley	reverse	66,89,71,82,77	I wish I had more self-discipline.	66,89,71,82,77	8500.0	brief		390212	s608	False
393.357	390.214	-0.10005000000000018	3.932	1.0	survey_medley	forward	66,89	Would you enjoy the sensation of skiing very fast down a high mountain slope?	66,89,71,82,77	8500.0	impulsive_venture		399758	s608	False
