movement_onset	onset	response_time	duration	coded_response	experiment_exp_id	item_coding	item_responses	item_text	possible_responses	stim_duration	survey	text	time_elapsed	worker_id	junk
3.13	1.003	-0.813525	3.932	5.0	survey_medley	forward	66,89,71,82,77	I refuse things that are bad for me.	66,89,71,82,77	8500.0	brief		10139	s634	False
12.526	10.141	-0.555525	3.932	3.0	survey_medley	reverse	66,89,71,82,77	I have a hard time breaking bad habits.	66,89,71,82,77	8500.0	brief		19753	s634	False
21.561	19.754	-1.1335250000000001	3.932	3.0	survey_medley	reverse	66,89,71,82,77	I have trouble concentrating.	66,89,71,82,77	8500.0	brief		29366	s634	False
31.213	29.368	-1.095525	3.932	1.0	survey_medley	reverse	66,89,71,82,77	I say inappropriate things.	66,89,71,82,77	8500.0	brief		39660	s634	False
41.169	39.661	-1.432525	3.932	5.0	survey_medley	forward	66,89,71,82,77	I could do anything I want in the future.	66,89,71,82,77	8500.0	future_time		49749	s634	False
55.631	49.751	2.939475	3.932	2.0	survey_medley	forward	66,89,71,82	Sometimes when I feel bad, I can't seem to stop what I am doing even though it is making me feel worse.	66,89,71,82,77	8500.0	upps		58819	s634	False
63.45	58.82	1.6894749999999998	3.932	3.0	survey_medley	reverse	66,89,71,82,77	I have difficulty maintaining my focus on projects that take more than a few months to complete.	66,89,71,82,77	8500.0	grit		68976	s634	False
70.517	68.978	-1.4015250000000001	3.932	4.0	survey_medley	forward	66,89,71,82,77	I am a hard worker.	66,89,71,82,77	8500.0	grit		78862	s634	False
81.946	78.863	0.1424749999999999	3.932	2.0	survey_medley	reverse	66,89,71,82,77	New ideas and projects sometimes distract me from previous ones.	66,89,71,82,77	8500.0	grit		88543	s634	False
90.948	88.545	-0.5375250000000001	3.932	3.0	survey_medley	reverse	66,89,71,82,77	I often act without thinking through all the alternatives.	66,89,71,82,77	8500.0	brief		98089	s634	False
100.707	98.09	-0.3235250000000001	3.932	3.0	survey_medley	reverse	66,89,71,82,77	I often set a goal but later choose to pursue a different one.	66,89,71,82,77	8500.0	grit		109402	s634	False
110.921	109.404	-1.4235250000000002	3.932	5.0	survey_medley	forward	66,89,71,82,77	Many opportunities await me in the future.	66,89,71,82,77	8500.0	future_time		119016	s634	False
121.011	119.017	-0.9465250000000001	3.932	4.0	survey_medley	forward	66,89,71,82,77	My future seems infinite to me.	66,89,71,82,77	8500.0	future_time		128221	s634	False
130.523	128.222	-0.6395250000000001	3.932	4.0	survey_medley	forward	66,89,71,82,77	There is plenty of time left in my life to make new plans.	66,89,71,82,77	8500.0	future_time		137766	s634	False
140.196	137.768	-0.5125250000000001	3.932	4.0	survey_medley	reverse	66,89,71,82,77	I am lazy.	66,89,71,82,77	8500.0	brief		147244	s634	False
150.683	147.245	0.4974749999999999	3.932	3.0	survey_medley	forward	66,89,71,82,77	Setbacks don't discourage me.	66,89,71,82,77	8500.0	grit		156449	s634	False
158.983	156.45	-0.4075250000000001	3.932	4.0	survey_medley	forward	66,89,71,82	When I am really excited, I tend not to think of the consequences of my actions.	66,89,71,82,77	8500.0	upps		166538	s634	False
168.853	166.54	-0.6275250000000001	3.932	2.0	survey_medley	forward	66,89	Do you sometimes like doing things that are a bit frightening?	66,89,71,82,77	8500.0	impulsive_venture		177444	s634	False
180.298	177.446	-0.08852500000000009	3.932	3.0	survey_medley	forward	66,89,71,82,77	I am good at resisting temptation.	66,89,71,82,77	8500.0	brief		187330	s634	False
192.894	187.331	2.622475	3.932	4.0	survey_medley	reverse	66,89,71,82,77	I do certain things that are bad for me, if they are fun.	66,89,71,82,77	8500.0	brief		196467	s634	False
198.525	196.468	-0.8835250000000001	3.932	4.0	survey_medley	forward	66,89,71,82,77	I am able to work effectively toward long-term goals.	66,89,71,82,77	8500.0	brief		206828	s634	False
210.543	206.83	0.7724749999999999	3.932	4.0	survey_medley	reverse	66,89,71,82,77	Pleasure and fun sometimes keep me from getting work done.	66,89,71,82,77	8500.0	brief		216510	s634	False
221.465	216.511	2.013475	3.932	2.0	survey_medley	forward	66,89,71,82	Others would say I make bad choices when I am extremely happy about something.	66,89,71,82,77	8500.0	upps		226667	s634	False
230.506	226.668	0.8974749999999999	3.932	2.0	survey_medley	forward	66,89,71,82,77	There are only limited possibilities in my future.	66,89,71,82,77	8500.0	future_time		235872	s634	False
237.79	235.874	-1.0245250000000001	3.932	3.0	survey_medley	forward	66,89,71,82,77	I finish whatever I begin.	66,89,71,82,77	8500.0	grit		247050	s634	False
248.734	247.051	-1.257525	3.932	5.0	survey_medley	forward	66,89,71,82,77	Most of my life lies ahead of me.	66,89,71,82,77	8500.0	future_time		256323	s634	False
259.31	256.325	0.04447499999999991	3.932	3.0	survey_medley	forward	66,89,71,82,77	People would say that I have iron self-discipline.	66,89,71,82,77	8500.0	brief		265937	s634	False
269.197	265.938	0.3184749999999999	3.932	4.0	survey_medley	reverse	66,89,71,82,77	Sometimes I can't stop myself from doing something, even if I know it is wrong.	66,89,71,82,77	8500.0	brief		275006	s634	False
277.548	275.007	-0.3995250000000001	3.932	2.0	survey_medley	forward	66,89	Do you welcome new and exciting experiences and sensations even if they are a little frightening and unconventional?	66,89,71,82,77	8500.0	impulsive_venture		284007	s634	False
287.165	284.009	0.21547499999999992	3.932	5.0	survey_medley	forward	66,89,71,82,77	I expect that I will set many new goals in the future.	66,89,71,82,77	8500.0	future_time		298313	s634	False
301.173	298.315	-0.08252500000000008	3.932	2.0	survey_medley	reverse	66,89,71,82,77	I wish I had more self-discipline.	66,89,71,82,77	8500.0	brief		307383	s634	False
313.633	307.384	3.308475	3.932	2.0	survey_medley	forward	66,89,71,82	When I get really happy about something, I tend to do things that can have bad consequences.	66,89,71,82,77	8500.0	upps		317676	s634	False
323.782	317.677	3.164475	3.932	2.0	survey_medley	forward	66,89,71,82	I tend to act without thinking when I am really excited.	66,89,71,82,77	8500.0	upps		329465	s634	False
331.089	329.467	-1.3185250000000002	3.932	5.0	survey_medley	forward	66,89,71,82,77	My future is filled with possibilities.	66,89,71,82,77	8500.0	future_time		338671	s634	False
342.166	338.672	0.5534749999999999	3.932	4.0	survey_medley	forward	66,89,71,82,77	As I get older, I begin to experience time as limited.	66,89,71,82,77	8500.0	future_time		348148	s634	False
350.292	348.15	-0.798525	3.932	4.0	survey_medley	forward	66,89,71,82,77	I am diligent.	66,89,71,82,77	8500.0	grit		358102	s634	False
360.856	358.104	-0.18852500000000008	3.932	2.0	survey_medley	forward	66,89,71,82	When overjoyed, I feel like I cant stop myself from going overboard.	66,89,71,82,77	8500.0	upps		369960	s634	False
373.136	369.961	0.2344749999999999	3.932	1.0	survey_medley	reverse	66,89,71,82,77	I have been obsessed with a certain idea or project for a short time but later lost interest.	66,89,71,82,77	8500.0	grit		379165	s634	False
381.127	379.167	-0.9805250000000001	3.932	2.0	survey_medley	forward	66,89	Would you enjoy the sensation of skiing very fast down a high mountain slope?	66,89,71,82,77	8500.0	impulsive_venture		390683	s634	False
393.083	390.684	-0.5415250000000001	3.932	2.0	survey_medley	forward	66,89,71,82,77	I have the sense that time is running out.	66,89,71,82,77	8500.0	future_time		399684	s634	False
