movement_onset	onset	response_time	duration	coded_response	experiment_exp_id	item_coding	item_responses	item_text	possible_responses	stim_duration	survey	text	time_elapsed	worker_id	junk
4.842	1.014	0.5756750000000002	3.932	3.0	survey_medley	reverse	66,89,71,82,77	Pleasure and fun sometimes keep me from getting work done.	66,89,71,82,77	8500.0	brief		11374	s641	False
19.153	11.38	4.520675	3.932	4.0	survey_medley	forward	66,89,71,82	Sometimes when I feel bad, I can't seem to stop what I am doing even though it is making me feel worse.	66,89,71,82,77	8500.0	upps		21060	s641	False
25.445	21.067	1.1256750000000002	3.932	5.0	survey_medley	forward	66,89,71,82,77	I am good at resisting temptation.	66,89,71,82,77	8500.0	brief		31223	s641	False
34.379	31.229	-0.10232499999999982	3.932	3.0	survey_medley	reverse	66,89,71,82,77	New ideas and projects sometimes distract me from previous ones.	66,89,71,82,77	8500.0	grit		40433	s641	False
43.599	40.438	-0.09132499999999982	3.932	2.0	survey_medley	forward	66,89,71,82,77	There are only limited possibilities in my future.	66,89,71,82,77	8500.0	future_time		51614	s641	False
55.548	51.621	0.6746750000000001	3.932	3.0	survey_medley	forward	66,89,71,82,77	I refuse things that are bad for me.	66,89,71,82,77	8500.0	brief		60893	s641	False
65.111	60.898	0.9606750000000002	3.932	3.0	survey_medley	reverse	66,89,71,82,77	I have difficulty maintaining my focus on projects that take more than a few months to complete.	66,89,71,82,77	8500.0	grit		70510	s641	False
72.968	70.512	-0.7963249999999998	3.932	4.0	survey_medley	forward	66,89,71,82,77	I could do anything I want in the future.	66,89,71,82,77	8500.0	future_time		79580	s641	False
82.404	79.586	-0.4343249999999998	3.932	3.0	survey_medley	forward	66,89,71,82,77	People would say that I have iron self-discipline.	66,89,71,82,77	8500.0	brief		88586	s641	False
92.386	88.591	0.5426750000000001	3.932	2.0	survey_medley	forward	66,89,71,82	I tend to act without thinking when I am really excited.	66,89,71,82,77	8500.0	upps		102895	s641	False
105.894	102.899	-0.2573249999999998	3.932	4.0	survey_medley	forward	66,89,71,82,77	I finish whatever I begin.	66,89,71,82,77	8500.0	grit		111967	s641	False
116.266	111.972	1.0416750000000001	3.932	4.0	survey_medley	reverse	66,89,71,82,77	I often set a goal but later choose to pursue a different one.	66,89,71,82,77	8500.0	grit		122264	s641	False
126.048	122.27	0.5256750000000002	3.932	3.0	survey_medley	forward	66,89,71,82,77	As I get older, I begin to experience time as limited.	66,89,71,82,77	8500.0	future_time		134058	s641	False
135.831	134.064	-1.4853249999999998	3.932	4.0	survey_medley	forward	66,89,71,82,77	My future is filled with possibilities.	66,89,71,82,77	8500.0	future_time		143268	s641	False
146.859	143.275	0.33167500000000016	3.932	4.0	survey_medley	forward	66,89,71,82,77	My future seems infinite to me.	66,89,71,82,77	8500.0	future_time		152751	s641	False
155.066	152.756	-0.9423249999999999	3.932	3.0	survey_medley	reverse	66,89,71,82,77	I wish I had more self-discipline.	66,89,71,82,77	8500.0	brief		162708	s641	False
165.315	162.714	-0.6513249999999998	3.932	4.0	survey_medley	forward	66,89,71,82,77	Most of my life lies ahead of me.	66,89,71,82,77	8500.0	future_time		174570	s641	False
176.859	174.577	-0.9703249999999998	3.932	5.0	survey_medley	forward	66,89,71,82,77	There is plenty of time left in my life to make new plans.	66,89,71,82,77	8500.0	future_time		183781	s641	False
188.569	183.787	1.5296750000000001	3.932	3.0	survey_medley	forward	66,89,71,82,77	I am able to work effectively toward long-term goals.	66,89,71,82,77	8500.0	brief		195303	s641	False
198.271	195.31	-0.29132499999999983	3.932	5.0	survey_medley	reverse	66,89,71,82,77	I say inappropriate things.	66,89,71,82,77	8500.0	brief		204310	s641	False
206.179	204.316	-1.389325	3.932	4.0	survey_medley	forward	66,89,71,82,77	Many opportunities await me in the future.	66,89,71,82,77	8500.0	future_time		213452	s641	False
215.005	213.454	-1.7013249999999998	3.932	4.0	survey_medley	reverse	66,89,71,82,77	I am lazy.	66,89,71,82,77	8500.0	brief		223066	s641	False
227.373	223.072	1.0486750000000002	3.932	3.0	survey_medley	reverse	66,89,71,82,77	I have been obsessed with a certain idea or project for a short time but later lost interest.	66,89,71,82,77	8500.0	grit		232684	s641	False
235.576	232.688	-0.36432499999999984	3.932	2.0	survey_medley	forward	66,89	Would you enjoy the sensation of skiing very fast down a high mountain slope?	66,89,71,82,77	8500.0	impulsive_venture		242980	s641	False
247.632	242.986	1.3936750000000002	3.932	1.0	survey_medley	forward	66,89,71,82	When overjoyed, I feel like I cant stop myself from going overboard.	66,89,71,82,77	8500.0	upps		253074	s641	False
254.939	253.078	-1.391325	3.932	4.0	survey_medley	forward	66,89,71,82,77	I am a hard worker.	66,89,71,82,77	8500.0	grit		262146	s641	False
265.127	262.152	-0.2773249999999998	3.932	4.0	survey_medley	reverse	66,89,71,82,77	I have trouble concentrating.	66,89,71,82,77	8500.0	brief		272308	s641	False
274.897	272.315	-0.6703249999999998	3.932	1.0	survey_medley	forward	66,89,71,82,77	I have the sense that time is running out.	66,89,71,82,77	8500.0	future_time		282199	s641	False
284.307	282.206	-1.1513249999999997	3.932	5.0	survey_medley	reverse	66,89,71,82,77	I often act without thinking through all the alternatives.	66,89,71,82,77	8500.0	brief		291886	s641	False
294.089	291.891	-1.0543249999999997	3.932	3.0	survey_medley	reverse	66,89,71,82,77	I have a hard time breaking bad habits.	66,89,71,82,77	8500.0	brief		301435	s641	False
304.886	301.442	0.19167500000000018	3.932	1.0	survey_medley	forward	66,89,71,82	When I am really excited, I tend not to think of the consequences of my actions.	66,89,71,82,77	8500.0	upps		312754	s641	False
314.929	312.759	-1.0823249999999998	3.932	2.0	survey_medley	forward	66,89,71,82,77	Setbacks don't discourage me.	66,89,71,82,77	8500.0	grit		322371	s641	False
326.889	322.378	1.2586750000000002	3.932	3.0	survey_medley	reverse	66,89,71,82,77	I do certain things that are bad for me, if they are fun.	66,89,71,82,77	8500.0	brief		331582	s641	False
334.901	331.587	0.06167500000000018	3.932	1.0	survey_medley	forward	66,89,71,82	Others would say I make bad choices when I am extremely happy about something.	66,89,71,82,77	8500.0	upps		341131	s641	False
345.306	341.136	0.9176750000000001	3.932	2.0	survey_medley	forward	66,89	Do you sometimes like doing things that are a bit frightening?	66,89,71,82,77	8500.0	impulsive_venture		350612	s641	False
354.025	350.616	0.15667500000000018	3.932	1.0	survey_medley	forward	66,89,71,82	When I get really happy about something, I tend to do things that can have bad consequences.	66,89,71,82,77	8500.0	upps		359820	s641	False
361.268	359.826	-1.8103249999999997	3.932	5.0	survey_medley	forward	66,89,71,82,77	I am diligent.	66,89,71,82,77	8500.0	grit		369914	s641	False
374.145	369.919	0.9736750000000002	3.932	5.0	survey_medley	reverse	66,89,71,82,77	Sometimes I can't stop myself from doing something, even if I know it is wrong.	66,89,71,82,77	8500.0	brief		380823	s641	False
382.975	380.827	-1.1043249999999998	3.932	5.0	survey_medley	forward	66,89,71,82,77	I expect that I will set many new goals in the future.	66,89,71,82,77	8500.0	future_time		390711	s641	False
394.154	390.714	0.18767500000000018	3.932	2.0	survey_medley	forward	66,89	Do you welcome new and exciting experiences and sensations even if they are a little frightening and unconventional?	66,89,71,82,77	8500.0	impulsive_venture		399850	s641	False
